{
  "items": [
    {
      "id": 1,
      "name": "Laptop",
      "description": "High-performance laptop",
      "price": 999.99,
      "category": "Electronics",
      "inStock": true,
      "createdAt": "2025-01-01T00:00:00Z"
    },
    {
      "id": 2,
      "name": "Wireless Mouse",
      "description": "Ergonomic wireless mouse",
      "price": 29.99,
      "category": "Accessories",
      "inStock": true,
      "createdAt": "2025-01-02T00:00:00Z"
    }
  ],
  "total": 50,
  "page": 1,
  "limit": 10,
  "totalPages": 5
}
